{
  "address": "0x92419d3c2ce2EF407F8705cf1A85b131bBcebf01",
  "abi": [
    {
      "inputs": [
        {
          "internalType": "address",
          "name": "_address",
          "type": "address"
        }
      ],
      "name": "addressToString",
      "outputs": [
        {
          "internalType": "string",
          "name": "",
          "type": "string"
        }
      ],
      "stateMutability": "pure",
      "type": "function"
    },
    {
      "inputs": [
        {
          "internalType": "string",
          "name": "url",
          "type": "string"
        },
        {
          "internalType": "uint256",
          "name": "tokenId",
          "type": "uint256"
        },
        {
          "internalType": "address",
          "name": "tokenAddress",
          "type": "address"
        }
      ],
      "name": "animationUrl",
      "outputs": [
        {
          "internalType": "string",
          "name": "",
          "type": "string"
        }
      ],
      "stateMutability": "pure",
      "type": "function"
    },
    {
      "inputs": [
        {
          "internalType": "string",
          "name": "url",
          "type": "string"
        },
        {
          "internalType": "uint256",
          "name": "tokenId",
          "type": "uint256"
        },
        {
          "internalType": "address",
          "name": "tokenAddress",
          "type": "address"
        },
        {
          "internalType": "uint256",
          "name": "seed",
          "type": "uint256"
        }
      ],
      "name": "animationUrl",
      "outputs": [
        {
          "internalType": "string",
          "name": "",
          "type": "string"
        }
      ],
      "stateMutability": "pure",
      "type": "function"
    },
    {
      "inputs": [
        {
          "internalType": "bytes",
          "name": "unencoded",
          "type": "bytes"
        }
      ],
      "name": "base64Encode",
      "outputs": [
        {
          "internalType": "string",
          "name": "",
          "type": "string"
        }
      ],
      "stateMutability": "pure",
      "type": "function"
    },
    {
      "inputs": [
        {
          "internalType": "string",
          "name": "name",
          "type": "string"
        },
        {
          "internalType": "string",
          "name": "description",
          "type": "string"
        },
        {
          "components": [
            {
              "internalType": "string",
              "name": "imageUrl",
              "type": "string"
            },
            {
              "internalType": "string",
              "name": "animationUrl",
              "type": "string"
            },
            {
              "internalType": "string",
              "name": "patchNotesUrl",
              "type": "string"
            },
            {
              "internalType": "uint8[3]",
              "name": "label",
              "type": "uint8[3]"
            }
          ],
          "internalType": "struct MediaData",
          "name": "media",
          "type": "tuple"
        },
        {
          "internalType": "uint256",
          "name": "tokenOfEdition",
          "type": "uint256"
        },
        {
          "internalType": "uint256",
          "name": "editionSize",
          "type": "uint256"
        },
        {
          "internalType": "address",
          "name": "tokenAddress",
          "type": "address"
        },
        {
          "internalType": "uint256",
          "name": "tokenSeed",
          "type": "uint256"
        }
      ],
      "name": "createMetadataEdition",
      "outputs": [
        {
          "internalType": "string",
          "name": "",
          "type": "string"
        }
      ],
      "stateMutability": "pure",
      "type": "function"
    },
    {
      "inputs": [
        {
          "internalType": "string",
          "name": "name",
          "type": "string"
        },
        {
          "internalType": "string",
          "name": "description",
          "type": "string"
        },
        {
          "components": [
            {
              "internalType": "string",
              "name": "imageUrl",
              "type": "string"
            },
            {
              "internalType": "string",
              "name": "animationUrl",
              "type": "string"
            },
            {
              "internalType": "string",
              "name": "patchNotesUrl",
              "type": "string"
            },
            {
              "internalType": "uint8[3]",
              "name": "label",
              "type": "uint8[3]"
            }
          ],
          "internalType": "struct MediaData",
          "name": "media",
          "type": "tuple"
        },
        {
          "internalType": "uint256",
          "name": "tokenOfEdition",
          "type": "uint256"
        },
        {
          "internalType": "uint256",
          "name": "editionSize",
          "type": "uint256"
        },
        {
          "internalType": "address",
          "name": "tokenAddress",
          "type": "address"
        }
      ],
      "name": "createMetadataEdition",
      "outputs": [
        {
          "internalType": "string",
          "name": "",
          "type": "string"
        }
      ],
      "stateMutability": "pure",
      "type": "function"
    },
    {
      "inputs": [
        {
          "internalType": "string",
          "name": "name",
          "type": "string"
        },
        {
          "internalType": "string",
          "name": "description",
          "type": "string"
        },
        {
          "internalType": "string",
          "name": "mediaData",
          "type": "string"
        },
        {
          "internalType": "uint256",
          "name": "tokenOfEdition",
          "type": "uint256"
        },
        {
          "internalType": "uint256",
          "name": "editionSize",
          "type": "uint256"
        }
      ],
      "name": "createMetadataJSON",
      "outputs": [
        {
          "internalType": "bytes",
          "name": "",
          "type": "bytes"
        }
      ],
      "stateMutability": "pure",
      "type": "function"
    },
    {
      "inputs": [
        {
          "internalType": "bytes",
          "name": "json",
          "type": "bytes"
        }
      ],
      "name": "encodeMetadataJSON",
      "outputs": [
        {
          "internalType": "string",
          "name": "",
          "type": "string"
        }
      ],
      "stateMutability": "pure",
      "type": "function"
    },
    {
      "inputs": [
        {
          "internalType": "string",
          "name": "url",
          "type": "string"
        },
        {
          "internalType": "uint256",
          "name": "id",
          "type": "uint256"
        }
      ],
      "name": "imageUrl",
      "outputs": [
        {
          "internalType": "string",
          "name": "",
          "type": "string"
        }
      ],
      "stateMutability": "pure",
      "type": "function"
    },
    {
      "inputs": [
        {
          "internalType": "uint256",
          "name": "value",
          "type": "uint256"
        }
      ],
      "name": "numberToString",
      "outputs": [
        {
          "internalType": "string",
          "name": "",
          "type": "string"
        }
      ],
      "stateMutability": "pure",
      "type": "function"
    },
    {
      "inputs": [
        {
          "components": [
            {
              "internalType": "string",
              "name": "imageUrl",
              "type": "string"
            },
            {
              "internalType": "string",
              "name": "animationUrl",
              "type": "string"
            },
            {
              "internalType": "string",
              "name": "patchNotesUrl",
              "type": "string"
            },
            {
              "internalType": "uint8[3]",
              "name": "label",
              "type": "uint8[3]"
            }
          ],
          "internalType": "struct MediaData",
          "name": "media",
          "type": "tuple"
        },
        {
          "internalType": "uint256",
          "name": "tokenOfEdition",
          "type": "uint256"
        },
        {
          "internalType": "address",
          "name": "tokenAddress",
          "type": "address"
        },
        {
          "internalType": "uint256",
          "name": "tokenSeed",
          "type": "uint256"
        }
      ],
      "name": "tokenMediaData",
      "outputs": [
        {
          "internalType": "string",
          "name": "",
          "type": "string"
        }
      ],
      "stateMutability": "pure",
      "type": "function"
    },
    {
      "inputs": [
        {
          "components": [
            {
              "internalType": "string",
              "name": "imageUrl",
              "type": "string"
            },
            {
              "internalType": "string",
              "name": "animationUrl",
              "type": "string"
            },
            {
              "internalType": "string",
              "name": "patchNotesUrl",
              "type": "string"
            },
            {
              "internalType": "uint8[3]",
              "name": "label",
              "type": "uint8[3]"
            }
          ],
          "internalType": "struct MediaData",
          "name": "media",
          "type": "tuple"
        },
        {
          "internalType": "uint256",
          "name": "tokenOfEdition",
          "type": "uint256"
        },
        {
          "internalType": "address",
          "name": "tokenAddress",
          "type": "address"
        }
      ],
      "name": "tokenMediaData",
      "outputs": [
        {
          "internalType": "string",
          "name": "",
          "type": "string"
        }
      ],
      "stateMutability": "pure",
      "type": "function"
    },
    {
      "inputs": [
        {
          "internalType": "uint8[3]",
          "name": "label",
          "type": "uint8[3]"
        }
      ],
      "name": "uintArray3ToString",
      "outputs": [
        {
          "internalType": "string",
          "name": "",
          "type": "string"
        }
      ],
      "stateMutability": "pure",
      "type": "function"
    },
    {
      "inputs": [
        {
          "internalType": "uint8[3]",
          "name": "label",
          "type": "uint8[3]"
        },
        {
          "internalType": "string",
          "name": "patchNotesUrl",
          "type": "string"
        }
      ],
      "name": "version",
      "outputs": [
        {
          "internalType": "string",
          "name": "",
          "type": "string"
        }
      ],
      "stateMutability": "pure",
      "type": "function"
    }
  ],
  "transactionHash": "0x814086803279e391b34ae0345b4169bc6c40da7e02c7be649fffec94ac7272d1",
  "receipt": {
    "to": null,
    "from": "0x5712869b7C8ca52B00Af7F6D924D4C841781ccd4",
    "contractAddress": "0x92419d3c2ce2EF407F8705cf1A85b131bBcebf01",
    "transactionIndex": 13,
    "gasUsed": "1320925",
    "logsBloom": "0x00000000000000000000000000000000000000000000000000000000000000000000000000000000000000000000000000008000000000000000000008000000000000000000000000000000000000800000000000000000000100000000000000000000000000000000000000000000000000000000000080004000000000000100000000000000000000008000000000040000000000000000000000000000200000000000000000000000000000000000000000000000000000000000004000000000000000000001000000000000000000000000000000100000000000000000000000000000000000000000000000000000000000000000000000100000",
    "blockHash": "0x8de8332ac83e9395c282141eb8b3c24df5adaef54b21278fcb7472dabba6c6b2",
    "transactionHash": "0x814086803279e391b34ae0345b4169bc6c40da7e02c7be649fffec94ac7272d1",
    "logs": [
      {
        "transactionIndex": 13,
        "blockNumber": 30941615,
        "transactionHash": "0x814086803279e391b34ae0345b4169bc6c40da7e02c7be649fffec94ac7272d1",
        "address": "0x0000000000000000000000000000000000001010",
        "topics": [
          "0x4dfe1bbbcf077ddc3e01291eea2d5c70c2b422b415d95645b9adcfd678cb1d63",
          "0x0000000000000000000000000000000000000000000000000000000000001010",
          "0x0000000000000000000000005712869b7c8ca52b00af7f6d924d4c841781ccd4",
          "0x00000000000000000000000000856730088a5c3191bd26eb482e45229555ce57"
        ],
        "data": "0x000000000000000000000000000000000000000000000000015fda0a4e54a5b300000000000000000000000000000000000000000000001f88a007ab93ef93b000000000000000000000000000000000000000000000039f9e401ef6c19a1c9000000000000000000000000000000000000000000000001f87402da1459aedfd00000000000000000000000000000000000000000000039f9f9ff9010feec243",
        "logIndex": 37,
        "blockHash": "0x8de8332ac83e9395c282141eb8b3c24df5adaef54b21278fcb7472dabba6c6b2"
      }
    ],
    "blockNumber": 30941615,
    "cumulativeGasUsed": "3567747",
    "status": 1,
    "byzantium": true
  },
  "args": [],
  "solcInputHash": "f1085c5b85cb82252ad324af67a4fa4d",
  "metadata": "{\"compiler\":{\"version\":\"0.8.6+commit.11564f7e\"},\"language\":\"Solidity\",\"output\":{\"abi\":[{\"inputs\":[{\"internalType\":\"address\",\"name\":\"_address\",\"type\":\"address\"}],\"name\":\"addressToString\",\"outputs\":[{\"internalType\":\"string\",\"name\":\"\",\"type\":\"string\"}],\"stateMutability\":\"pure\",\"type\":\"function\"},{\"inputs\":[{\"internalType\":\"string\",\"name\":\"url\",\"type\":\"string\"},{\"internalType\":\"uint256\",\"name\":\"tokenId\",\"type\":\"uint256\"},{\"internalType\":\"address\",\"name\":\"tokenAddress\",\"type\":\"address\"}],\"name\":\"animationUrl\",\"outputs\":[{\"internalType\":\"string\",\"name\":\"\",\"type\":\"string\"}],\"stateMutability\":\"pure\",\"type\":\"function\"},{\"inputs\":[{\"internalType\":\"string\",\"name\":\"url\",\"type\":\"string\"},{\"internalType\":\"uint256\",\"name\":\"tokenId\",\"type\":\"uint256\"},{\"internalType\":\"address\",\"name\":\"tokenAddress\",\"type\":\"address\"},{\"internalType\":\"uint256\",\"name\":\"seed\",\"type\":\"uint256\"}],\"name\":\"animationUrl\",\"outputs\":[{\"internalType\":\"string\",\"name\":\"\",\"type\":\"string\"}],\"stateMutability\":\"pure\",\"type\":\"function\"},{\"inputs\":[{\"internalType\":\"bytes\",\"name\":\"unencoded\",\"type\":\"bytes\"}],\"name\":\"base64Encode\",\"outputs\":[{\"internalType\":\"string\",\"name\":\"\",\"type\":\"string\"}],\"stateMutability\":\"pure\",\"type\":\"function\"},{\"inputs\":[{\"internalType\":\"string\",\"name\":\"name\",\"type\":\"string\"},{\"internalType\":\"string\",\"name\":\"description\",\"type\":\"string\"},{\"components\":[{\"internalType\":\"string\",\"name\":\"imageUrl\",\"type\":\"string\"},{\"internalType\":\"string\",\"name\":\"animationUrl\",\"type\":\"string\"},{\"internalType\":\"string\",\"name\":\"patchNotesUrl\",\"type\":\"string\"},{\"internalType\":\"uint8[3]\",\"name\":\"label\",\"type\":\"uint8[3]\"}],\"internalType\":\"struct MediaData\",\"name\":\"media\",\"type\":\"tuple\"},{\"internalType\":\"uint256\",\"name\":\"tokenOfEdition\",\"type\":\"uint256\"},{\"internalType\":\"uint256\",\"name\":\"editionSize\",\"type\":\"uint256\"},{\"internalType\":\"address\",\"name\":\"tokenAddress\",\"type\":\"address\"},{\"internalType\":\"uint256\",\"name\":\"tokenSeed\",\"type\":\"uint256\"}],\"name\":\"createMetadataEdition\",\"outputs\":[{\"internalType\":\"string\",\"name\":\"\",\"type\":\"string\"}],\"stateMutability\":\"pure\",\"type\":\"function\"},{\"inputs\":[{\"internalType\":\"string\",\"name\":\"name\",\"type\":\"string\"},{\"internalType\":\"string\",\"name\":\"description\",\"type\":\"string\"},{\"components\":[{\"internalType\":\"string\",\"name\":\"imageUrl\",\"type\":\"string\"},{\"internalType\":\"string\",\"name\":\"animationUrl\",\"type\":\"string\"},{\"internalType\":\"string\",\"name\":\"patchNotesUrl\",\"type\":\"string\"},{\"internalType\":\"uint8[3]\",\"name\":\"label\",\"type\":\"uint8[3]\"}],\"internalType\":\"struct MediaData\",\"name\":\"media\",\"type\":\"tuple\"},{\"internalType\":\"uint256\",\"name\":\"tokenOfEdition\",\"type\":\"uint256\"},{\"internalType\":\"uint256\",\"name\":\"editionSize\",\"type\":\"uint256\"},{\"internalType\":\"address\",\"name\":\"tokenAddress\",\"type\":\"address\"}],\"name\":\"createMetadataEdition\",\"outputs\":[{\"internalType\":\"string\",\"name\":\"\",\"type\":\"string\"}],\"stateMutability\":\"pure\",\"type\":\"function\"},{\"inputs\":[{\"internalType\":\"string\",\"name\":\"name\",\"type\":\"string\"},{\"internalType\":\"string\",\"name\":\"description\",\"type\":\"string\"},{\"internalType\":\"string\",\"name\":\"mediaData\",\"type\":\"string\"},{\"internalType\":\"uint256\",\"name\":\"tokenOfEdition\",\"type\":\"uint256\"},{\"internalType\":\"uint256\",\"name\":\"editionSize\",\"type\":\"uint256\"}],\"name\":\"createMetadataJSON\",\"outputs\":[{\"internalType\":\"bytes\",\"name\":\"\",\"type\":\"bytes\"}],\"stateMutability\":\"pure\",\"type\":\"function\"},{\"inputs\":[{\"internalType\":\"bytes\",\"name\":\"json\",\"type\":\"bytes\"}],\"name\":\"encodeMetadataJSON\",\"outputs\":[{\"internalType\":\"string\",\"name\":\"\",\"type\":\"string\"}],\"stateMutability\":\"pure\",\"type\":\"function\"},{\"inputs\":[{\"internalType\":\"string\",\"name\":\"url\",\"type\":\"string\"},{\"internalType\":\"uint256\",\"name\":\"id\",\"type\":\"uint256\"}],\"name\":\"imageUrl\",\"outputs\":[{\"internalType\":\"string\",\"name\":\"\",\"type\":\"string\"}],\"stateMutability\":\"pure\",\"type\":\"function\"},{\"inputs\":[{\"internalType\":\"uint256\",\"name\":\"value\",\"type\":\"uint256\"}],\"name\":\"numberToString\",\"outputs\":[{\"internalType\":\"string\",\"name\":\"\",\"type\":\"string\"}],\"stateMutability\":\"pure\",\"type\":\"function\"},{\"inputs\":[{\"components\":[{\"internalType\":\"string\",\"name\":\"imageUrl\",\"type\":\"string\"},{\"internalType\":\"string\",\"name\":\"animationUrl\",\"type\":\"string\"},{\"internalType\":\"string\",\"name\":\"patchNotesUrl\",\"type\":\"string\"},{\"internalType\":\"uint8[3]\",\"name\":\"label\",\"type\":\"uint8[3]\"}],\"internalType\":\"struct MediaData\",\"name\":\"media\",\"type\":\"tuple\"},{\"internalType\":\"uint256\",\"name\":\"tokenOfEdition\",\"type\":\"uint256\"},{\"internalType\":\"address\",\"name\":\"tokenAddress\",\"type\":\"address\"},{\"internalType\":\"uint256\",\"name\":\"tokenSeed\",\"type\":\"uint256\"}],\"name\":\"tokenMediaData\",\"outputs\":[{\"internalType\":\"string\",\"name\":\"\",\"type\":\"string\"}],\"stateMutability\":\"pure\",\"type\":\"function\"},{\"inputs\":[{\"components\":[{\"internalType\":\"string\",\"name\":\"imageUrl\",\"type\":\"string\"},{\"internalType\":\"string\",\"name\":\"animationUrl\",\"type\":\"string\"},{\"internalType\":\"string\",\"name\":\"patchNotesUrl\",\"type\":\"string\"},{\"internalType\":\"uint8[3]\",\"name\":\"label\",\"type\":\"uint8[3]\"}],\"internalType\":\"struct MediaData\",\"name\":\"media\",\"type\":\"tuple\"},{\"internalType\":\"uint256\",\"name\":\"tokenOfEdition\",\"type\":\"uint256\"},{\"internalType\":\"address\",\"name\":\"tokenAddress\",\"type\":\"address\"}],\"name\":\"tokenMediaData\",\"outputs\":[{\"internalType\":\"string\",\"name\":\"\",\"type\":\"string\"}],\"stateMutability\":\"pure\",\"type\":\"function\"},{\"inputs\":[{\"internalType\":\"uint8[3]\",\"name\":\"label\",\"type\":\"uint8[3]\"}],\"name\":\"uintArray3ToString\",\"outputs\":[{\"internalType\":\"string\",\"name\":\"\",\"type\":\"string\"}],\"stateMutability\":\"pure\",\"type\":\"function\"},{\"inputs\":[{\"internalType\":\"uint8[3]\",\"name\":\"label\",\"type\":\"uint8[3]\"},{\"internalType\":\"string\",\"name\":\"patchNotesUrl\",\"type\":\"string\"}],\"name\":\"version\",\"outputs\":[{\"internalType\":\"string\",\"name\":\"\",\"type\":\"string\"}],\"stateMutability\":\"pure\",\"type\":\"function\"}],\"devdoc\":{\"details\":\"Can safely be used for generic base64Encode and numberToString functions\",\"kind\":\"dev\",\"methods\":{\"addressToString(address)\":{\"params\":{\"_address\":\"address to return as a string\"}},\"base64Encode(bytes)\":{\"params\":{\"unencoded\":\"bytes to base64-encode\"}},\"createMetadataEdition(string,string,(string,string,string,uint8[3]),uint256,uint256,address)\":{\"params\":{\"description\":\"Description of NFT in metadata\",\"editionSize\":\"Size of entire edition to show\",\"media\":\"The image Url, animation Url and version label of the media to be rendered\",\"name\":\"Name of NFT in metadata\",\"tokenAddress\":\"Address of the NFT\",\"tokenOfEdition\":\"Token ID for specific token\"}},\"createMetadataEdition(string,string,(string,string,string,uint8[3]),uint256,uint256,address,uint256)\":{\"params\":{\"description\":\"Description of NFT in metadata\",\"editionSize\":\"Size of entire edition to show\",\"media\":\"The image Url, animation Url and version label of the media to be rendered\",\"name\":\"Name of NFT in metadata\",\"tokenAddress\":\"Address of the NFT\",\"tokenOfEdition\":\"Token ID for specific token\"}},\"createMetadataJSON(string,string,string,uint256,uint256)\":{\"params\":{\"description\":\"Description of NFT in metadata\",\"editionSize\":\"Size of entire edition to show\",\"mediaData\":\"Data for media to include in json object\",\"name\":\"Name of NFT in metadata\",\"tokenOfEdition\":\"Token ID for specific token\"}},\"encodeMetadataJSON(bytes)\":{\"params\":{\"json\":\"Raw json to base64 and turn into a data-uri\"}},\"numberToString(uint256)\":{\"params\":{\"value\":\"number to return as a string\"}},\"tokenMediaData((string,string,string,uint8[3]),uint256,address)\":{\"params\":{\"media\":\"urls of image and animation media with version label\"}},\"tokenMediaData((string,string,string,uint8[3]),uint256,address,uint256)\":{\"params\":{\"media\":\"urls of image and animation media with version label\"}}},\"version\":1},\"userdoc\":{\"kind\":\"user\",\"methods\":{\"addressToString(address)\":{\"notice\":\"converts address to string\"},\"createMetadataEdition(string,string,(string,string,string,uint8[3]),uint256,uint256,address)\":{\"notice\":\"Generate edition metadata from storage information as base64-json blob Combines the media data and metadata\"},\"createMetadataEdition(string,string,(string,string,string,uint8[3]),uint256,uint256,address,uint256)\":{\"notice\":\"Generate edition metadata from storage information as base64-json blob Combines the media data and metadata\"},\"createMetadataJSON(string,string,string,uint256,uint256)\":{\"notice\":\"Function to create the metadata json string for the nft edition\"},\"encodeMetadataJSON(bytes)\":{\"notice\":\"Encodes the argument json bytes into base64-data uri format\"},\"numberToString(uint256)\":{\"notice\":\"Proxy to openzeppelin's toString function\"},\"tokenMediaData((string,string,string,uint8[3]),uint256,address)\":{\"notice\":\"Generates edition metadata from storage information as base64-json blob Combines the media data and metadata\"},\"tokenMediaData((string,string,string,uint8[3]),uint256,address,uint256)\":{\"notice\":\"Generates edition metadata from storage information as base64-json blob Combines the media data and metadata\"}},\"notice\":\"Shared NFT logic for rendering metadata associated with editions\",\"version\":1}},\"settings\":{\"compilationTarget\":{\"contracts/SharedNFTLogic.sol\":\"SharedNFTLogic\"},\"evmVersion\":\"berlin\",\"libraries\":{},\"metadata\":{\"bytecodeHash\":\"ipfs\",\"useLiteralContent\":true},\"optimizer\":{\"enabled\":true,\"runs\":100},\"remappings\":[]},\"sources\":{\"@openzeppelin/contracts-upgradeable/utils/StringsUpgradeable.sol\":{\"content\":\"// SPDX-License-Identifier: MIT\\n\\npragma solidity ^0.8.0;\\n\\n/**\\n * @dev String operations.\\n */\\nlibrary StringsUpgradeable {\\n    bytes16 private constant _HEX_SYMBOLS = \\\"0123456789abcdef\\\";\\n\\n    /**\\n     * @dev Converts a `uint256` to its ASCII `string` decimal representation.\\n     */\\n    function toString(uint256 value) internal pure returns (string memory) {\\n        // Inspired by OraclizeAPI's implementation - MIT licence\\n        // https://github.com/oraclize/ethereum-api/blob/b42146b063c7d6ee1358846c198246239e9360e8/oraclizeAPI_0.4.25.sol\\n\\n        if (value == 0) {\\n            return \\\"0\\\";\\n        }\\n        uint256 temp = value;\\n        uint256 digits;\\n        while (temp != 0) {\\n            digits++;\\n            temp /= 10;\\n        }\\n        bytes memory buffer = new bytes(digits);\\n        while (value != 0) {\\n            digits -= 1;\\n            buffer[digits] = bytes1(uint8(48 + uint256(value % 10)));\\n            value /= 10;\\n        }\\n        return string(buffer);\\n    }\\n\\n    /**\\n     * @dev Converts a `uint256` to its ASCII `string` hexadecimal representation.\\n     */\\n    function toHexString(uint256 value) internal pure returns (string memory) {\\n        if (value == 0) {\\n            return \\\"0x00\\\";\\n        }\\n        uint256 temp = value;\\n        uint256 length = 0;\\n        while (temp != 0) {\\n            length++;\\n            temp >>= 8;\\n        }\\n        return toHexString(value, length);\\n    }\\n\\n    /**\\n     * @dev Converts a `uint256` to its ASCII `string` hexadecimal representation with fixed length.\\n     */\\n    function toHexString(uint256 value, uint256 length) internal pure returns (string memory) {\\n        bytes memory buffer = new bytes(2 * length + 2);\\n        buffer[0] = \\\"0\\\";\\n        buffer[1] = \\\"x\\\";\\n        for (uint256 i = 2 * length + 1; i > 1; --i) {\\n            buffer[i] = _HEX_SYMBOLS[value & 0xf];\\n            value >>= 4;\\n        }\\n        require(value == 0, \\\"Strings: hex length insufficient\\\");\\n        return string(buffer);\\n    }\\n}\\n\",\"keccak256\":\"0xc7af08df3d3e818ce36f95aa879c13245772fed21b553e6033292ea4edc2a9f3\",\"license\":\"MIT\"},\"base64-sol/base64.sol\":{\"content\":\"// SPDX-License-Identifier: MIT\\n\\n/// @title Base64\\n/// @author Brecht Devos - <brecht@loopring.org>\\n/// @notice Provides a function for encoding some bytes in base64\\nlibrary Base64 {\\n    string internal constant TABLE = 'ABCDEFGHIJKLMNOPQRSTUVWXYZabcdefghijklmnopqrstuvwxyz0123456789+/';\\n\\n    function encode(bytes memory data) internal pure returns (string memory) {\\n        if (data.length == 0) return '';\\n        \\n        // load the table into memory\\n        string memory table = TABLE;\\n\\n        // multiply by 4/3 rounded up\\n        uint256 encodedLen = 4 * ((data.length + 2) / 3);\\n\\n        // add some extra buffer at the end required for the writing\\n        string memory result = new string(encodedLen + 32);\\n\\n        assembly {\\n            // set the actual output length\\n            mstore(result, encodedLen)\\n            \\n            // prepare the lookup table\\n            let tablePtr := add(table, 1)\\n            \\n            // input ptr\\n            let dataPtr := data\\n            let endPtr := add(dataPtr, mload(data))\\n            \\n            // result ptr, jump over length\\n            let resultPtr := add(result, 32)\\n            \\n            // run over the input, 3 bytes at a time\\n            for {} lt(dataPtr, endPtr) {}\\n            {\\n               dataPtr := add(dataPtr, 3)\\n               \\n               // read 3 bytes\\n               let input := mload(dataPtr)\\n               \\n               // write 4 characters\\n               mstore(resultPtr, shl(248, mload(add(tablePtr, and(shr(18, input), 0x3F)))))\\n               resultPtr := add(resultPtr, 1)\\n               mstore(resultPtr, shl(248, mload(add(tablePtr, and(shr(12, input), 0x3F)))))\\n               resultPtr := add(resultPtr, 1)\\n               mstore(resultPtr, shl(248, mload(add(tablePtr, and(shr( 6, input), 0x3F)))))\\n               resultPtr := add(resultPtr, 1)\\n               mstore(resultPtr, shl(248, mload(add(tablePtr, and(        input,  0x3F)))))\\n               resultPtr := add(resultPtr, 1)\\n            }\\n            \\n            // padding with '='\\n            switch mod(mload(data), 3)\\n            case 1 { mstore(sub(resultPtr, 2), shl(240, 0x3d3d)) }\\n            case 2 { mstore(sub(resultPtr, 1), shl(248, 0x3d)) }\\n        }\\n        \\n        return result;\\n    }\\n}\\n\",\"keccak256\":\"0x0c8ad17afea99676d4dbab1857f52a7660b67602a79d03abd0a4c742074bbeb3\",\"license\":\"MIT\"},\"contracts/IPublicSharedMetadata.sol\":{\"content\":\"// SPDX-License-Identifier: GPL-3.0\\npragma solidity ^0.8.6;\\n\\n/// Shared public library for on-chain NFT functions\\ninterface IPublicSharedMetadata {\\n    /// @param unencoded bytes to base64-encode\\n    function base64Encode(bytes memory unencoded)\\n        external\\n        pure\\n        returns (string memory);\\n\\n    /// Encodes the argument json bytes into base64-data uri format\\n    /// @param json Raw json to base64 and turn into a data-uri\\n    function encodeMetadataJSON(bytes memory json)\\n        external\\n        pure\\n        returns (string memory);\\n\\n    /// Proxy to openzeppelin's toString function\\n    /// @param value number to return as a string\\n    function numberToString(uint256 value)\\n        external\\n        pure\\n        returns (string memory);\\n}\\n\",\"keccak256\":\"0xa5f156c261db1274830f5b64c64352a379555d3709780e0ab491491cd9e94566\",\"license\":\"GPL-3.0\"},\"contracts/SharedNFTLogic.sol\":{\"content\":\"// SPDX-License-Identifier: GPL-3.0\\n\\npragma solidity ^0.8.6;\\n\\nimport {StringsUpgradeable} from \\\"@openzeppelin/contracts-upgradeable/utils/StringsUpgradeable.sol\\\";\\nimport {Base64} from \\\"base64-sol/base64.sol\\\";\\nimport {IPublicSharedMetadata} from \\\"./IPublicSharedMetadata.sol\\\";\\nimport {Versions} from \\\"./Versions.sol\\\";\\n\\nstruct MediaData{\\n    string imageUrl;\\n    string animationUrl;\\n    string patchNotesUrl;\\n    uint8[3] label;\\n}\\n\\n/// Shared NFT logic for rendering metadata associated with editions\\n/// @dev Can safely be used for generic base64Encode and numberToString functions\\ncontract SharedNFTLogic is IPublicSharedMetadata {\\n    /// @param unencoded bytes to base64-encode\\n    function base64Encode(bytes memory unencoded)\\n        public\\n        pure\\n        override\\n        returns (string memory)\\n    {\\n        return Base64.encode(unencoded);\\n    }\\n\\n    /// Proxy to openzeppelin's toString function\\n    /// @param value number to return as a string\\n    function numberToString(uint256 value)\\n        public\\n        pure\\n        override\\n        returns (string memory)\\n    {\\n        return StringsUpgradeable.toString(value);\\n    }\\n\\n    /// @notice converts address to string\\n    /// @param _address address to return as a string\\n    function addressToString(address _address) public pure returns(string memory) {\\n        bytes20 _bytes = bytes20(_address);\\n        bytes memory HEX = \\\"0123456789abcdef\\\";\\n        bytes memory _string = new bytes(42);\\n        _string[0] = '0';\\n        _string[1] = 'x';\\n        for(uint i = 0; i < 20; i++) {\\n            _string[2+i*2] = HEX[uint8(_bytes[i] >> 4)];\\n            _string[3+i*2] = HEX[uint8(_bytes[i] & 0x0f)];\\n        }\\n        return string(_string);\\n    }\\n\\n    // Proxy to olta's uintArray3ToString function\\n    function uintArray3ToString (uint8[3] memory label)\\n        public\\n        pure\\n        returns (string memory)\\n    {\\n        return Versions.uintArray3ToString(label);\\n    }\\n\\n    /// Generate edition metadata from storage information as base64-json blob\\n    /// Combines the media data and metadata\\n    /// @param name Name of NFT in metadata\\n    /// @param description Description of NFT in metadata\\n    /// @param media The image Url, animation Url and version label of the media to be rendered\\n    /// @param tokenOfEdition Token ID for specific token\\n    /// @param editionSize Size of entire edition to show\\n    /// @param tokenAddress Address of the NFT\\n    function createMetadataEdition(\\n        string memory name,\\n        string memory description,\\n        MediaData memory media,\\n        uint256 tokenOfEdition,\\n        uint256 editionSize,\\n        address tokenAddress\\n    ) external pure returns (string memory) {\\n        string memory _tokenMediaData = tokenMediaData(\\n            media,\\n            tokenOfEdition,\\n            tokenAddress\\n        );\\n        bytes memory json = createMetadataJSON(\\n            name,\\n            description,\\n            _tokenMediaData,\\n            tokenOfEdition,\\n            editionSize\\n        );\\n        return encodeMetadataJSON(json);\\n    }\\n\\n    /// Generate edition metadata from storage information as base64-json blob\\n    /// Combines the media data and metadata\\n    /// @param name Name of NFT in metadata\\n    /// @param description Description of NFT in metadata\\n    /// @param media The image Url, animation Url and version label of the media to be rendered\\n    /// @param tokenOfEdition Token ID for specific token\\n    /// @param editionSize Size of entire edition to show\\n    /// @param tokenAddress Address of the NFT\\n    function createMetadataEdition(\\n        string memory name,\\n        string memory description,\\n        MediaData memory media,\\n        uint256 tokenOfEdition,\\n        uint256 editionSize,\\n        address tokenAddress,\\n        uint256 tokenSeed\\n    ) external pure returns (string memory) {\\n        string memory _tokenMediaData = tokenMediaData(\\n            media,\\n            tokenOfEdition,\\n            tokenAddress,\\n            tokenSeed\\n        );\\n        bytes memory json = createMetadataJSON(\\n            name,\\n            description,\\n            _tokenMediaData,\\n            tokenOfEdition,\\n            editionSize\\n        );\\n        return encodeMetadataJSON(json);\\n    }\\n\\n    /// Function to create the metadata json string for the nft edition\\n    /// @param name Name of NFT in metadata\\n    /// @param description Description of NFT in metadata\\n    /// @param mediaData Data for media to include in json object\\n    /// @param tokenOfEdition Token ID for specific token\\n    /// @param editionSize Size of entire edition to show\\n    function createMetadataJSON(\\n        string memory name,\\n        string memory description,\\n        string memory mediaData,\\n        uint256 tokenOfEdition,\\n        uint256 editionSize\\n    ) public pure returns (bytes memory) {\\n        bytes memory editionSizeText;\\n        if (editionSize > 0) {\\n            editionSizeText = abi.encodePacked(\\n                \\\"/\\\",\\n                numberToString(editionSize)\\n            );\\n        }\\n        return\\n            abi.encodePacked(\\n                '{\\\"name\\\": \\\"',\\n                name,\\n                \\\" \\\",\\n                numberToString(tokenOfEdition),\\n                editionSizeText,\\n                '\\\", \\\"',\\n                'description\\\": \\\"',\\n                description,\\n                '\\\", \\\"',\\n                mediaData,\\n                'properties\\\": {\\\"number\\\": ',\\n                numberToString(tokenOfEdition),\\n                ', \\\"name\\\": \\\"',\\n                name,\\n                '\\\"}}'\\n            );\\n    }\\n\\n    /// Encodes the argument json bytes into base64-data uri format\\n    /// @param json Raw json to base64 and turn into a data-uri\\n    function encodeMetadataJSON(bytes memory json)\\n        public\\n        pure\\n        override\\n        returns (string memory)\\n    {\\n        return\\n            string(\\n                abi.encodePacked(\\n                    \\\"data:application/json;base64,\\\",\\n                    base64Encode(json)\\n                )\\n            );\\n    }\\n\\n    /// Generates edition metadata from storage information as base64-json blob\\n    /// Combines the media data and metadata\\n    /// @param media urls of image and animation media with version label\\n    function tokenMediaData(\\n        MediaData memory media,\\n        uint256 tokenOfEdition,\\n        address tokenAddress\\n    ) public pure returns (string memory) {\\n        bool hasImage = bytes(media.imageUrl).length > 0;\\n        bool hasAnimation = bytes(media.animationUrl).length > 0;\\n        if (hasImage && hasAnimation) {\\n            return\\n                string(\\n                    abi.encodePacked(\\n                        imageUrl(\\n                            media.imageUrl,\\n                            tokenOfEdition\\n                        ),\\n                        animationUrl(\\n                            media.animationUrl,\\n                            tokenOfEdition,\\n                            tokenAddress\\n                        ),\\n                        version(\\n                            media.label,\\n                            media.patchNotesUrl\\n                        )\\n                    )\\n                );\\n        }\\n        if (hasImage) {\\n            return\\n                string(\\n                    abi.encodePacked(\\n                        imageUrl(\\n                            media.imageUrl,\\n                            tokenOfEdition\\n                        ),\\n                        version(\\n                            media.label,\\n                            media.patchNotesUrl\\n                        )\\n                    )\\n                );\\n        }\\n        if (hasAnimation) {\\n            return\\n                string(\\n                    abi.encodePacked(\\n                        animationUrl(\\n                            media.animationUrl,\\n                            tokenOfEdition,\\n                            tokenAddress\\n                        ),\\n                        version(\\n                            media.label,\\n                            media.patchNotesUrl\\n                        )\\n                    )\\n                );\\n        }\\n\\n        return \\\"\\\";\\n    }\\n\\n    /// Generates edition metadata from storage information as base64-json blob\\n    /// Combines the media data and metadata\\n    /// @param media urls of image and animation media with version label\\n    function tokenMediaData(\\n        MediaData memory media,\\n        uint256 tokenOfEdition,\\n        address tokenAddress,\\n        uint256 tokenSeed\\n    ) public pure returns (string memory) {\\n        bool hasImage = bytes(media.imageUrl).length > 0;\\n        bool hasAnimation = bytes(media.animationUrl).length > 0;\\n        if (hasImage && hasAnimation) {\\n            return\\n                string(\\n                    abi.encodePacked(\\n                        imageUrl(\\n                            media.imageUrl,\\n                            tokenSeed\\n                        ),\\n                        animationUrl(\\n                            media.animationUrl,\\n                            tokenOfEdition,\\n                            tokenAddress,\\n                            tokenSeed\\n                        ),\\n                        version(\\n                            media.label,\\n                            media.patchNotesUrl\\n                        )\\n                    )\\n                );\\n        }\\n        if (hasImage) {\\n            return\\n                string(\\n                    abi.encodePacked(\\n                        imageUrl(\\n                            media.imageUrl,\\n                            tokenSeed\\n                        ),\\n                        version(\\n                            media.label,\\n                            media.patchNotesUrl\\n                        )\\n                    )\\n                );\\n        }\\n        if (hasAnimation) {\\n            return\\n                string(\\n                    abi.encodePacked(\\n                        animationUrl(\\n                            media.animationUrl,\\n                            tokenOfEdition,\\n                            tokenAddress,\\n                            tokenSeed\\n                        ),\\n                        version(\\n                            media.label,\\n                            media.patchNotesUrl\\n                        )\\n                    )\\n                );\\n        }\\n\\n        return \\\"\\\";\\n    }\\n\\n    function version(\\n        uint8[3] memory label,\\n        string memory patchNotesUrl\\n    ) public pure returns (string memory) {\\n        return string (\\n            abi.encodePacked(\\n                'media_version\\\": \\\"',\\n                uintArray3ToString(label),\\n                '\\\", \\\"'\\n                'patch_notes\\\": \\\"',\\n                patchNotesUrl,\\n                '\\\", \\\"'\\n            )\\n        );\\n    }\\n\\n    function imageUrl(\\n        string memory url,\\n        uint256 id\\n    ) public pure returns (string memory) {\\n        return string (\\n            abi.encodePacked(\\n                'image\\\": \\\"',\\n                url,\\n                 \\\"?id=\\\", // if just url \\\"/id\\\" this will work with arweave pathmanifests\\n                numberToString(id),\\n                '\\\", \\\"'\\n            )\\n        );\\n    }\\n\\n    function animationUrl(\\n        string memory url,\\n        uint256 tokenId,\\n        address tokenAddress\\n    ) public pure returns (string memory) {\\n        return string (\\n            abi.encodePacked(\\n                'animation_url\\\": \\\"',\\n                url,\\n                \\\"?id=\\\",\\n                numberToString(tokenId),\\n                \\\"&address=\\\",\\n                addressToString(tokenAddress),\\n                '\\\", \\\"'\\n            )\\n        );\\n    }\\n\\n    function animationUrl(\\n        string memory url,\\n        uint256 tokenId,\\n        address tokenAddress,\\n        uint256 seed\\n    ) public pure returns (string memory) {\\n        return string (\\n            abi.encodePacked(\\n                'animation_url\\\": \\\"',\\n                url,\\n                \\\"?id=\\\",\\n                numberToString(tokenId),\\n                \\\"&address=\\\",\\n                addressToString(tokenAddress),\\n                \\\"&seed=\\\",\\n                numberToString(seed),\\n                '\\\", \\\"'\\n            )\\n        );\\n    }\\n}\\n\",\"keccak256\":\"0x3bef9ad370a8692aa93e18db235ef0ba3752bbb119de1d1a2a65bd7cf59d502a\",\"license\":\"GPL-3.0\"},\"contracts/Versions.sol\":{\"content\":\"// SPDX-License-Identifier: GPL-3.0\\n\\npragma solidity 0.8.6;\\n\\nimport {StringsUpgradeable} from \\\"@openzeppelin/contracts-upgradeable/utils/StringsUpgradeable.sol\\\";\\n\\n/**\\n @title A libary for versioning of NFT content and metadata\\n @dev Provides versioning for nft content and follows the semantic labeling convention.\\n Each version contains an array of content and content hash pairs as well as a version label.\\n Versions can be added and urls can be updated along with getters to retrieve specific versions and history.\\n\\n Include with `using Versions for Versions.set;`\\n @author george baldwin\\n */\\n\\nlibrary Versions {\\n\\n    struct UrlHashPair {\\n        string url;\\n        bytes32 sha256hash;\\n    }\\n\\n    struct Version {\\n        UrlHashPair[] urls;\\n        uint8[3] label;\\n    }\\n\\n    struct Set {\\n        string[] labels;\\n        mapping(string => Version) versions;\\n    }\\n\\n    /**\\n     @dev creates a new version from array of url hashe pairs and a semantic label\\n     @param urls An array of urls with sha-256 hash of the content on that url\\n     @param label a version label in a semantic style\\n     */\\n    function createVersion(\\n        UrlHashPair[] memory urls,\\n        uint8[3] memory label\\n    )\\n        internal\\n        pure\\n        returns (Version memory)\\n    {\\n        Version memory version = Version(urls, label);\\n        return version;\\n    }\\n\\n    /**\\n     @dev adds a version to a given set by pushing the version label to an array\\n        and mapping the version to a string of that label. Will revert if the label already exists.\\n     @param set the set to add the version to\\n     @param version the version that will be stored\\n     */\\n    function addVersion(\\n        Set storage set,\\n        Version memory version\\n    ) internal {\\n\\n        string memory labelKey = uintArray3ToString(version.label);\\n\\n        require(\\n            set.versions[labelKey].urls.length == 0,\\n            \\\"#Versions: A version with that label already exists\\\"\\n        );\\n\\n        // add to labels array\\n        set.labels.push(labelKey);\\n\\n        // store urls and hashes in mapping\\n        for (uint256 i = 0; i < version.urls.length; i++){\\n            set.versions[labelKey].urls.push(version.urls[i]);\\n        }\\n\\n        // store label\\n        set.versions[labelKey].label = version.label;\\n    }\\n\\n    /**\\n     @dev gets a version from a given set. Will revert if the version doesn't exist.\\n     @param set The set to get the version from\\n     @param label The label of the requested version\\n     @return version The version corrosponeding to the label\\n     */\\n    function getVersion(\\n        Set storage set,\\n        uint8[3] memory label\\n    )\\n        internal\\n        view\\n        returns (Version memory)\\n    {\\n        Version memory version = set.versions[uintArray3ToString(label)];\\n        require(\\n            version.urls.length != 0,\\n            \\\"#Versions: The version does not exist\\\"\\n        );\\n        return version;\\n    }\\n\\n    /**\\n     @dev updates a url of a given version in a given set\\n     @param set The set containing the version of which the url will be updated\\n     @param label The label of the requested version\\n     @param index The index of the url\\n     @param newUrl The new url to be updated to\\n     */\\n    function updateVersionURL(\\n        Set storage set,\\n        uint8[3] memory label,\\n        uint256 index,\\n        string memory newUrl\\n    ) internal {\\n        string memory labelKey = uintArray3ToString(label);\\n        require(\\n            set.versions[labelKey].urls.length != 0,\\n            \\\"#Versions: The version does not exist\\\"\\n        );\\n        require(\\n            set.versions[labelKey].urls.length > index,\\n            \\\"#Versions: The url does not exist on that version\\\"\\n        );\\n        set.versions[labelKey].urls[index].url = newUrl;\\n    }\\n\\n    /**\\n     @dev gets all the version labels of a given set\\n     @param set The set containing the versions\\n     @return labels an array of labels as strings\\n    */\\n    function getAllLabels(\\n        Set storage set\\n    )\\n        internal\\n        view\\n        returns (string[] memory)\\n    {\\n        return set.labels;\\n    }\\n\\n    /**\\n     @dev gets all the versions of a given set\\n     @param set The set containing the versions\\n     @return versions an array of versions\\n    */\\n    function getAllVersions(\\n        Set storage set\\n    )\\n        internal\\n        view\\n        returns (Version[] memory)\\n    {\\n        return getVersionsFromLabels(set, set.labels);\\n    }\\n\\n    /**\\n     @dev gets the versions of a given array of labels as strings, reverts if no labels are given\\n     @param set The set containing the versions\\n     @return versions an array of versions\\n    */\\n    function getVersionsFromLabels(\\n        Set storage set,\\n        string[] memory _labels\\n    )\\n        internal\\n        view\\n        returns (Version[] memory)\\n    {\\n        require(_labels.length != 0, \\\"#Versions: No labels provided\\\");\\n        Version[] memory versionArray = new Version[](_labels.length);\\n\\n        for (uint256 i = 0; i < _labels.length; i++) {\\n                versionArray[i] = set.versions[_labels[i]];\\n        }\\n\\n        return versionArray;\\n    }\\n\\n    /**\\n     @dev gets the last added version of a given set, reverts if no versions are in the set\\n     @param set The set containing the versions\\n     @return version the last added version\\n    */\\n    function getLatestVersion(\\n        Set storage set\\n    )\\n        internal\\n        view\\n        returns (Version memory)\\n    {\\n        require(\\n            set.labels.length != 0,\\n            \\\"#Versions: No versions exist\\\"\\n        );\\n        return set.versions[\\n            set.labels[set.labels.length - 1]\\n        ];\\n    }\\n\\n    /**\\n     @dev A helper function to convert a three length array of numbers into a semantic style verison label\\n     @param label the label as a uint8[3] array\\n     @return label the label as a string\\n    */\\n    function uintArray3ToString (uint8[3] memory label)\\n        internal\\n        pure\\n        returns (string memory)\\n    {\\n        return string(abi.encodePacked(\\n            StringsUpgradeable.toString(label[0]),\\n            \\\".\\\",\\n            StringsUpgradeable.toString(label[1]),\\n            \\\".\\\",\\n            StringsUpgradeable.toString(label[2])\\n        ));\\n    }\\n}\",\"keccak256\":\"0x0c57f7a1764998753c382556ffee075a74875dc39460cb3bed3842bf5fbb9012\",\"license\":\"GPL-3.0\"}},\"version\":1}",
  "bytecode": "0x608060405234801561001057600080fd5b506116ef806100206000396000f3fe608060405234801561001057600080fd5b50600436106100ca5760003560e01c80635a7eba7c1161007c5780635a7eba7c1461016a5780635e57966d1461017d578063612d07171461019057806389b1d1c8146101a3578063d01fde8c146101b6578063d5fb1b19146101c9578063f1f32c4d146101dc57600080fd5b806302ceae25146100cf578063170dc660146100f85780631dac3c861461010b5780631e18f9091461011e5780633a05ec46146101315780634f29f99f1461014457806358464f3014610157575b600080fd5b6100e26100dd366004610f3c565b6101ef565b6040516100ef919061154d565b60405180910390f35b6100e261010636600461105f565b61022f565b6100e2610119366004610f92565b610240565b6100e261012c366004610c6a565b61028b565b6100e261013f366004611027565b6102bf565b6100e2610152366004610e43565b61039d565b6100e2610165366004610d00565b6103d7565b6100e2610178366004610d99565b610453565b6100e261018b366004610c33565b61048b565b6100e261019e366004610c4e565b61065b565b6100e26101b1366004610ef8565b610666565b6100e26101c4366004610cb8565b610683565b6100e26101d7366004610cb8565b6106b4565b6100e26101ea366004610ff0565b6106bf565b6060836101fb8461022f565b6102048461048b565b604051602001610216939291906114b4565b60405160208183030381529060405290505b9392505050565b606061023a8261079a565b92915050565b60608461024c8561022f565b6102558561048b565b61025e8561022f565b60405160200161027194939291906113f3565b60405160208183030381529060405290505b949350505050565b60606102968361065b565b826040516020016102a892919061118c565b604051602081830303815290604052905092915050565b8351516020850151516060911580159115159082906102db5750805b156103385786516102ec9085610666565b6102fc8860200151888888610240565b61030e89606001518a6040015161028b565b604051602001610320939291906110ef565b60405160208183030381529060405292505050610283565b811561036d57865161034a9085610666565b61035c8860600151896040015161028b565b6040516020016103209291906110c0565b80156103835761034a8760200151878787610240565b505060408051602081019091526000815295945050505050565b606060006103ad878786866102bf565b905060006103be8a8a848a8a6103d7565b90506103c981610683565b9a9950505050505050505050565b606080821561040b576103e98361022f565b6040516020016103f991906113ca565b60405160208183030381529060405290505b866104158561022f565b8288886104218961022f565b8c604051602001610438979695949392919061126f565b60405160208183030381529060405291505095945050505050565b606060006104628686856106bf565b9050600061047389898489896103d7565b905061047e81610683565b9998505050505050505050565b604080518082018252601081526f181899199a1a9b1b9c1cb0b131b232b360811b60208201528151602a808252606082810190945284841b9291600091602082018180368337019050509050600360fc1b816000815181106104ef576104ef61164d565b60200101906001600160f81b031916908160001a905350600f60fb1b8160018151811061051e5761051e61164d565b60200101906001600160f81b031916908160001a90535060005b6014811015610652578260048583601481106105565761055661164d565b1a60f81b6001600160f81b031916901c60f81c60ff168151811061057c5761057c61164d565b01602001516001600160f81b0319168261059783600261158c565b6105a2906002611560565b815181106105b2576105b261164d565b60200101906001600160f81b031916908160001a905350828482601481106105dc576105dc61164d565b825191901a600f169081106105f3576105f361164d565b01602001516001600160f81b0319168261060e83600261158c565b610619906003611560565b815181106106295761062961164d565b60200101906001600160f81b031916908160001a9053508061064a816115f2565b915050610538565b50949350505050565b606061023a82610897565b6060826106728361022f565b6040516020016102a8929190611209565b606061068e826106b4565b60405160200161069e9190611385565b6040516020818303038152906040529050919050565b606061023a826108d5565b8251516020840151516060911580159115159082906106db5750805b156107375785516106ec9086610666565b6106fb876020015187876101ef565b61070d8860600151896040015161028b565b60405160200161071f939291906110ef565b60405160208183030381529060405292505050610228565b811561076c5785516107499086610666565b61075b8760600151886040015161028b565b60405160200161071f9291906110c0565b801561078157610749866020015186866101ef565b5050604080516020810190915260008152949350505050565b6060816107be5750506040805180820190915260018152600360fc1b602082015290565b8160005b81156107e857806107d2816115f2565b91506107e19050600a83611578565b91506107c2565b6000816001600160401b0381111561080257610802611663565b6040519080825280601f01601f19166020018201604052801561082c576020820181803683370190505b5090505b8415610283576108416001836115ab565b915061084e600a8661160d565b610859906030611560565b60f81b81838151811061086e5761086e61164d565b60200101906001600160f81b031916908160001a905350610890600a86611578565b9450610830565b60606108ad8260005b602002015160ff1661079a565b6108b88360016108a0565b6108c38460026108a0565b60405160200161069e93929190611132565b60608151600014156108f557505060408051602081019091526000815290565b600060405180606001604052806040815260200161167a60409139905060006003845160026109249190611560565b61092e9190611578565b61093990600461158c565b90506000610948826020611560565b6001600160401b0381111561095f5761095f611663565b6040519080825280601f01601f191660200182016040528015610989576020820181803683370190505b509050818152600183018586518101602084015b818310156109f75760039283018051603f601282901c811687015160f890811b8552600c83901c8216880151811b6001860152600683901c8216880151811b60028601529116860151901b9382019390935260040161099d565b600389510660018114610a115760028114610a2257610a2e565b613d3d60f01b600119830152610a2e565b603d60f81b6000198301525b509398975050505050505050565b60006001600160401b0380841115610a5657610a56611663565b604051601f8501601f19908116603f01168101908282118183101715610a7e57610a7e611663565b81604052809350858152868686011115610a9757600080fd5b858560208301376000602087830101525050509392505050565b80356001600160a01b0381168114610ac857600080fd5b919050565b600082601f830112610ade57600080fd5b604051606081018181106001600160401b0382111715610b0057610b00611663565b604052808360608101861015610b1557600080fd5b6000805b6003811015610b4757823560ff81168114610b32578283fd5b84526020938401939290920191600101610b19565b50929695505050505050565b600082601f830112610b6457600080fd5b61022883833560208501610a3c565b600060c08284031215610b8557600080fd5b604051608081016001600160401b038282108183111715610ba857610ba8611663565b816040528293508435915080821115610bc057600080fd5b610bcc86838701610b53565b83526020850135915080821115610be257600080fd5b610bee86838701610b53565b60208401526040850135915080821115610c0757600080fd5b50610c1485828601610b53565b604083015250610c278460608501610acd565b60608201525092915050565b600060208284031215610c4557600080fd5b61022882610ab1565b600060608284031215610c6057600080fd5b6102288383610acd565b60008060808385031215610c7d57600080fd5b610c878484610acd565b915060608301356001600160401b03811115610ca257600080fd5b610cae85828601610b53565b9150509250929050565b600060208284031215610cca57600080fd5b81356001600160401b03811115610ce057600080fd5b8201601f81018413610cf157600080fd5b61028384823560208401610a3c565b600080600080600060a08688031215610d1857600080fd5b85356001600160401b0380821115610d2f57600080fd5b610d3b89838a01610b53565b96506020880135915080821115610d5157600080fd5b610d5d89838a01610b53565b95506040880135915080821115610d7357600080fd5b50610d8088828901610b53565b9598949750949560608101359550608001359392505050565b60008060008060008060c08789031215610db257600080fd5b86356001600160401b0380821115610dc957600080fd5b610dd58a838b01610b53565b97506020890135915080821115610deb57600080fd5b610df78a838b01610b53565b96506040890135915080821115610e0d57600080fd5b50610e1a89828a01610b73565b9450506060870135925060808701359150610e3760a08801610ab1565b90509295509295509295565b600080600080600080600060e0888a031215610e5e57600080fd5b87356001600160401b0380821115610e7557600080fd5b610e818b838c01610b53565b985060208a0135915080821115610e9757600080fd5b610ea38b838c01610b53565b975060408a0135915080821115610eb957600080fd5b50610ec68a828b01610b73565b9550506060880135935060808801359250610ee360a08901610ab1565b915060c0880135905092959891949750929550565b60008060408385031215610f0b57600080fd5b82356001600160401b03811115610f2157600080fd5b610f2d85828601610b53565b95602094909401359450505050565b600080600060608486031215610f5157600080fd5b83356001600160401b03811115610f6757600080fd5b610f7386828701610b53565b93505060208401359150610f8960408501610ab1565b90509250925092565b60008060008060808587031215610fa857600080fd5b84356001600160401b03811115610fbe57600080fd5b610fca87828801610b53565b94505060208501359250610fe060408601610ab1565b9396929550929360600135925050565b60008060006060848603121561100557600080fd5b83356001600160401b0381111561101b57600080fd5b610f7386828701610b73565b6000806000806080858703121561103d57600080fd5b84356001600160401b0381111561105357600080fd5b610fca87828801610b73565b60006020828403121561107157600080fd5b5035919050565b600081518084526110908160208601602086016115c2565b601f01601f19169290920160200192915050565b600081516110b68185602086016115c2565b9290920192915050565b600083516110d28184602088016115c2565b8351908301906110e68183602088016115c2565b01949350505050565b600084516111018184602089016115c2565b8451908301906111158183602089016115c2565b84519101906111288183602088016115c2565b0195945050505050565b600084516111448184602089016115c2565b8083019050601760f91b8082528551611164816001850160208a016115c2565b6001920191820152835161117f8160028401602088016115c2565b0160020195945050505050565b7036b2b234b0afbb32b939b4b7b7111d101160791b815282516000906111b98160118501602088016115c2565b72111610113830ba31b42fb737ba32b9911d101160691b60119184019182015283516111ec8160248401602088016115c2565b631116101160e11b60249290910191820152602801949350505050565b6834b6b0b3b2911d101160b91b8152825160009061122e8160098501602088016115c2565b633f69643d60e01b600991840191820152835161125281600d8401602088016115c2565b631116101160e11b600d9290910191820152601101949350505050565b693d913730b6b2911d101160b11b8152875160009061129581600a850160208d016115c2565b600160fd1b600a9184019182015288516112b681600b840160208d016115c2565b88519101906112cc81600b840160208c016115c2565b631116101160e11b600b929091019182018190526e3232b9b1b934b83a34b7b7111d101160891b600f830152875161130b81601e850160208c016115c2565b601e9201918201526103c961137661137061135961135361132f602287018c6110a4565b770383937b832b93a34b2b9911d103d91373ab6b132b9111d160451b815260180190565b896110a4565b6a1610113730b6b2911d101160a91b8152600b0190565b866110a4565b62227d7d60e81b815260030190565b7f646174613a6170706c69636174696f6e2f6a736f6e3b6261736536342c0000008152600082516113bd81601d8501602087016115c2565b91909101601d0192915050565b602f60f81b8152600082516113e68160018501602087016115c2565b9190910160010192915050565b7030b734b6b0ba34b7b72fbab936111d101160791b81528451600090611420816011850160208a016115c2565b633f69643d60e01b6011918401918201528551611444816015840160208a016115c2565b6826616464726573733d60b81b60159290910191820152845161146e81601e8401602089016115c2565b6526736565643d60d01b601e929091019182015283516114958160248401602088016115c2565b631116101160e11b602492909101918201526028019695505050505050565b7030b734b6b0ba34b7b72fbab936111d101160791b815283516000906114e18160118501602089016115c2565b633f69643d60e01b60119184019182015284516115058160158401602089016115c2565b6826616464726573733d60b81b60159290910191820152835161152f81601e8401602088016115c2565b631116101160e11b601e929091019182015260220195945050505050565b6020815260006102286020830184611078565b6000821982111561157357611573611621565b500190565b60008261158757611587611637565b500490565b60008160001904831182151516156115a6576115a6611621565b500290565b6000828210156115bd576115bd611621565b500390565b60005b838110156115dd5781810151838201526020016115c5565b838111156115ec576000848401525b50505050565b600060001982141561160657611606611621565b5060010190565b60008261161c5761161c611637565b500690565b634e487b7160e01b600052601160045260246000fd5b634e487b7160e01b600052601260045260246000fd5b634e487b7160e01b600052603260045260246000fd5b634e487b7160e01b600052604160045260246000fdfe4142434445464748494a4b4c4d4e4f505152535455565758595a6162636465666768696a6b6c6d6e6f707172737475767778797a303132333435363738392b2fa26469706673582212209c3e000e4aa5bb1664ef9e54dbea6303e7c3e4f91c8aab217c2b20801f94bfbb64736f6c63430008060033",
  "deployedBytecode": "0x608060405234801561001057600080fd5b50600436106100ca5760003560e01c80635a7eba7c1161007c5780635a7eba7c1461016a5780635e57966d1461017d578063612d07171461019057806389b1d1c8146101a3578063d01fde8c146101b6578063d5fb1b19146101c9578063f1f32c4d146101dc57600080fd5b806302ceae25146100cf578063170dc660146100f85780631dac3c861461010b5780631e18f9091461011e5780633a05ec46146101315780634f29f99f1461014457806358464f3014610157575b600080fd5b6100e26100dd366004610f3c565b6101ef565b6040516100ef919061154d565b60405180910390f35b6100e261010636600461105f565b61022f565b6100e2610119366004610f92565b610240565b6100e261012c366004610c6a565b61028b565b6100e261013f366004611027565b6102bf565b6100e2610152366004610e43565b61039d565b6100e2610165366004610d00565b6103d7565b6100e2610178366004610d99565b610453565b6100e261018b366004610c33565b61048b565b6100e261019e366004610c4e565b61065b565b6100e26101b1366004610ef8565b610666565b6100e26101c4366004610cb8565b610683565b6100e26101d7366004610cb8565b6106b4565b6100e26101ea366004610ff0565b6106bf565b6060836101fb8461022f565b6102048461048b565b604051602001610216939291906114b4565b60405160208183030381529060405290505b9392505050565b606061023a8261079a565b92915050565b60608461024c8561022f565b6102558561048b565b61025e8561022f565b60405160200161027194939291906113f3565b60405160208183030381529060405290505b949350505050565b60606102968361065b565b826040516020016102a892919061118c565b604051602081830303815290604052905092915050565b8351516020850151516060911580159115159082906102db5750805b156103385786516102ec9085610666565b6102fc8860200151888888610240565b61030e89606001518a6040015161028b565b604051602001610320939291906110ef565b60405160208183030381529060405292505050610283565b811561036d57865161034a9085610666565b61035c8860600151896040015161028b565b6040516020016103209291906110c0565b80156103835761034a8760200151878787610240565b505060408051602081019091526000815295945050505050565b606060006103ad878786866102bf565b905060006103be8a8a848a8a6103d7565b90506103c981610683565b9a9950505050505050505050565b606080821561040b576103e98361022f565b6040516020016103f991906113ca565b60405160208183030381529060405290505b866104158561022f565b8288886104218961022f565b8c604051602001610438979695949392919061126f565b60405160208183030381529060405291505095945050505050565b606060006104628686856106bf565b9050600061047389898489896103d7565b905061047e81610683565b9998505050505050505050565b604080518082018252601081526f181899199a1a9b1b9c1cb0b131b232b360811b60208201528151602a808252606082810190945284841b9291600091602082018180368337019050509050600360fc1b816000815181106104ef576104ef61164d565b60200101906001600160f81b031916908160001a905350600f60fb1b8160018151811061051e5761051e61164d565b60200101906001600160f81b031916908160001a90535060005b6014811015610652578260048583601481106105565761055661164d565b1a60f81b6001600160f81b031916901c60f81c60ff168151811061057c5761057c61164d565b01602001516001600160f81b0319168261059783600261158c565b6105a2906002611560565b815181106105b2576105b261164d565b60200101906001600160f81b031916908160001a905350828482601481106105dc576105dc61164d565b825191901a600f169081106105f3576105f361164d565b01602001516001600160f81b0319168261060e83600261158c565b610619906003611560565b815181106106295761062961164d565b60200101906001600160f81b031916908160001a9053508061064a816115f2565b915050610538565b50949350505050565b606061023a82610897565b6060826106728361022f565b6040516020016102a8929190611209565b606061068e826106b4565b60405160200161069e9190611385565b6040516020818303038152906040529050919050565b606061023a826108d5565b8251516020840151516060911580159115159082906106db5750805b156107375785516106ec9086610666565b6106fb876020015187876101ef565b61070d8860600151896040015161028b565b60405160200161071f939291906110ef565b60405160208183030381529060405292505050610228565b811561076c5785516107499086610666565b61075b8760600151886040015161028b565b60405160200161071f9291906110c0565b801561078157610749866020015186866101ef565b5050604080516020810190915260008152949350505050565b6060816107be5750506040805180820190915260018152600360fc1b602082015290565b8160005b81156107e857806107d2816115f2565b91506107e19050600a83611578565b91506107c2565b6000816001600160401b0381111561080257610802611663565b6040519080825280601f01601f19166020018201604052801561082c576020820181803683370190505b5090505b8415610283576108416001836115ab565b915061084e600a8661160d565b610859906030611560565b60f81b81838151811061086e5761086e61164d565b60200101906001600160f81b031916908160001a905350610890600a86611578565b9450610830565b60606108ad8260005b602002015160ff1661079a565b6108b88360016108a0565b6108c38460026108a0565b60405160200161069e93929190611132565b60608151600014156108f557505060408051602081019091526000815290565b600060405180606001604052806040815260200161167a60409139905060006003845160026109249190611560565b61092e9190611578565b61093990600461158c565b90506000610948826020611560565b6001600160401b0381111561095f5761095f611663565b6040519080825280601f01601f191660200182016040528015610989576020820181803683370190505b509050818152600183018586518101602084015b818310156109f75760039283018051603f601282901c811687015160f890811b8552600c83901c8216880151811b6001860152600683901c8216880151811b60028601529116860151901b9382019390935260040161099d565b600389510660018114610a115760028114610a2257610a2e565b613d3d60f01b600119830152610a2e565b603d60f81b6000198301525b509398975050505050505050565b60006001600160401b0380841115610a5657610a56611663565b604051601f8501601f19908116603f01168101908282118183101715610a7e57610a7e611663565b81604052809350858152868686011115610a9757600080fd5b858560208301376000602087830101525050509392505050565b80356001600160a01b0381168114610ac857600080fd5b919050565b600082601f830112610ade57600080fd5b604051606081018181106001600160401b0382111715610b0057610b00611663565b604052808360608101861015610b1557600080fd5b6000805b6003811015610b4757823560ff81168114610b32578283fd5b84526020938401939290920191600101610b19565b50929695505050505050565b600082601f830112610b6457600080fd5b61022883833560208501610a3c565b600060c08284031215610b8557600080fd5b604051608081016001600160401b038282108183111715610ba857610ba8611663565b816040528293508435915080821115610bc057600080fd5b610bcc86838701610b53565b83526020850135915080821115610be257600080fd5b610bee86838701610b53565b60208401526040850135915080821115610c0757600080fd5b50610c1485828601610b53565b604083015250610c278460608501610acd565b60608201525092915050565b600060208284031215610c4557600080fd5b61022882610ab1565b600060608284031215610c6057600080fd5b6102288383610acd565b60008060808385031215610c7d57600080fd5b610c878484610acd565b915060608301356001600160401b03811115610ca257600080fd5b610cae85828601610b53565b9150509250929050565b600060208284031215610cca57600080fd5b81356001600160401b03811115610ce057600080fd5b8201601f81018413610cf157600080fd5b61028384823560208401610a3c565b600080600080600060a08688031215610d1857600080fd5b85356001600160401b0380821115610d2f57600080fd5b610d3b89838a01610b53565b96506020880135915080821115610d5157600080fd5b610d5d89838a01610b53565b95506040880135915080821115610d7357600080fd5b50610d8088828901610b53565b9598949750949560608101359550608001359392505050565b60008060008060008060c08789031215610db257600080fd5b86356001600160401b0380821115610dc957600080fd5b610dd58a838b01610b53565b97506020890135915080821115610deb57600080fd5b610df78a838b01610b53565b96506040890135915080821115610e0d57600080fd5b50610e1a89828a01610b73565b9450506060870135925060808701359150610e3760a08801610ab1565b90509295509295509295565b600080600080600080600060e0888a031215610e5e57600080fd5b87356001600160401b0380821115610e7557600080fd5b610e818b838c01610b53565b985060208a0135915080821115610e9757600080fd5b610ea38b838c01610b53565b975060408a0135915080821115610eb957600080fd5b50610ec68a828b01610b73565b9550506060880135935060808801359250610ee360a08901610ab1565b915060c0880135905092959891949750929550565b60008060408385031215610f0b57600080fd5b82356001600160401b03811115610f2157600080fd5b610f2d85828601610b53565b95602094909401359450505050565b600080600060608486031215610f5157600080fd5b83356001600160401b03811115610f6757600080fd5b610f7386828701610b53565b93505060208401359150610f8960408501610ab1565b90509250925092565b60008060008060808587031215610fa857600080fd5b84356001600160401b03811115610fbe57600080fd5b610fca87828801610b53565b94505060208501359250610fe060408601610ab1565b9396929550929360600135925050565b60008060006060848603121561100557600080fd5b83356001600160401b0381111561101b57600080fd5b610f7386828701610b73565b6000806000806080858703121561103d57600080fd5b84356001600160401b0381111561105357600080fd5b610fca87828801610b73565b60006020828403121561107157600080fd5b5035919050565b600081518084526110908160208601602086016115c2565b601f01601f19169290920160200192915050565b600081516110b68185602086016115c2565b9290920192915050565b600083516110d28184602088016115c2565b8351908301906110e68183602088016115c2565b01949350505050565b600084516111018184602089016115c2565b8451908301906111158183602089016115c2565b84519101906111288183602088016115c2565b0195945050505050565b600084516111448184602089016115c2565b8083019050601760f91b8082528551611164816001850160208a016115c2565b6001920191820152835161117f8160028401602088016115c2565b0160020195945050505050565b7036b2b234b0afbb32b939b4b7b7111d101160791b815282516000906111b98160118501602088016115c2565b72111610113830ba31b42fb737ba32b9911d101160691b60119184019182015283516111ec8160248401602088016115c2565b631116101160e11b60249290910191820152602801949350505050565b6834b6b0b3b2911d101160b91b8152825160009061122e8160098501602088016115c2565b633f69643d60e01b600991840191820152835161125281600d8401602088016115c2565b631116101160e11b600d9290910191820152601101949350505050565b693d913730b6b2911d101160b11b8152875160009061129581600a850160208d016115c2565b600160fd1b600a9184019182015288516112b681600b840160208d016115c2565b88519101906112cc81600b840160208c016115c2565b631116101160e11b600b929091019182018190526e3232b9b1b934b83a34b7b7111d101160891b600f830152875161130b81601e850160208c016115c2565b601e9201918201526103c961137661137061135961135361132f602287018c6110a4565b770383937b832b93a34b2b9911d103d91373ab6b132b9111d160451b815260180190565b896110a4565b6a1610113730b6b2911d101160a91b8152600b0190565b866110a4565b62227d7d60e81b815260030190565b7f646174613a6170706c69636174696f6e2f6a736f6e3b6261736536342c0000008152600082516113bd81601d8501602087016115c2565b91909101601d0192915050565b602f60f81b8152600082516113e68160018501602087016115c2565b9190910160010192915050565b7030b734b6b0ba34b7b72fbab936111d101160791b81528451600090611420816011850160208a016115c2565b633f69643d60e01b6011918401918201528551611444816015840160208a016115c2565b6826616464726573733d60b81b60159290910191820152845161146e81601e8401602089016115c2565b6526736565643d60d01b601e929091019182015283516114958160248401602088016115c2565b631116101160e11b602492909101918201526028019695505050505050565b7030b734b6b0ba34b7b72fbab936111d101160791b815283516000906114e18160118501602089016115c2565b633f69643d60e01b60119184019182015284516115058160158401602089016115c2565b6826616464726573733d60b81b60159290910191820152835161152f81601e8401602088016115c2565b631116101160e11b601e929091019182015260220195945050505050565b6020815260006102286020830184611078565b6000821982111561157357611573611621565b500190565b60008261158757611587611637565b500490565b60008160001904831182151516156115a6576115a6611621565b500290565b6000828210156115bd576115bd611621565b500390565b60005b838110156115dd5781810151838201526020016115c5565b838111156115ec576000848401525b50505050565b600060001982141561160657611606611621565b5060010190565b60008261161c5761161c611637565b500690565b634e487b7160e01b600052601160045260246000fd5b634e487b7160e01b600052601260045260246000fd5b634e487b7160e01b600052603260045260246000fd5b634e487b7160e01b600052604160045260246000fdfe4142434445464748494a4b4c4d4e4f505152535455565758595a6162636465666768696a6b6c6d6e6f707172737475767778797a303132333435363738392b2fa26469706673582212209c3e000e4aa5bb1664ef9e54dbea6303e7c3e4f91c8aab217c2b20801f94bfbb64736f6c63430008060033",
  "devdoc": {
    "details": "Can safely be used for generic base64Encode and numberToString functions",
    "kind": "dev",
    "methods": {
      "addressToString(address)": {
        "params": {
          "_address": "address to return as a string"
        }
      },
      "base64Encode(bytes)": {
        "params": {
          "unencoded": "bytes to base64-encode"
        }
      },
      "createMetadataEdition(string,string,(string,string,string,uint8[3]),uint256,uint256,address)": {
        "params": {
          "description": "Description of NFT in metadata",
          "editionSize": "Size of entire edition to show",
          "media": "The image Url, animation Url and version label of the media to be rendered",
          "name": "Name of NFT in metadata",
          "tokenAddress": "Address of the NFT",
          "tokenOfEdition": "Token ID for specific token"
        }
      },
      "createMetadataEdition(string,string,(string,string,string,uint8[3]),uint256,uint256,address,uint256)": {
        "params": {
          "description": "Description of NFT in metadata",
          "editionSize": "Size of entire edition to show",
          "media": "The image Url, animation Url and version label of the media to be rendered",
          "name": "Name of NFT in metadata",
          "tokenAddress": "Address of the NFT",
          "tokenOfEdition": "Token ID for specific token"
        }
      },
      "createMetadataJSON(string,string,string,uint256,uint256)": {
        "params": {
          "description": "Description of NFT in metadata",
          "editionSize": "Size of entire edition to show",
          "mediaData": "Data for media to include in json object",
          "name": "Name of NFT in metadata",
          "tokenOfEdition": "Token ID for specific token"
        }
      },
      "encodeMetadataJSON(bytes)": {
        "params": {
          "json": "Raw json to base64 and turn into a data-uri"
        }
      },
      "numberToString(uint256)": {
        "params": {
          "value": "number to return as a string"
        }
      },
      "tokenMediaData((string,string,string,uint8[3]),uint256,address)": {
        "params": {
          "media": "urls of image and animation media with version label"
        }
      },
      "tokenMediaData((string,string,string,uint8[3]),uint256,address,uint256)": {
        "params": {
          "media": "urls of image and animation media with version label"
        }
      }
    },
    "version": 1
  },
  "userdoc": {
    "kind": "user",
    "methods": {
      "addressToString(address)": {
        "notice": "converts address to string"
      },
      "createMetadataEdition(string,string,(string,string,string,uint8[3]),uint256,uint256,address)": {
        "notice": "Generate edition metadata from storage information as base64-json blob Combines the media data and metadata"
      },
      "createMetadataEdition(string,string,(string,string,string,uint8[3]),uint256,uint256,address,uint256)": {
        "notice": "Generate edition metadata from storage information as base64-json blob Combines the media data and metadata"
      },
      "createMetadataJSON(string,string,string,uint256,uint256)": {
        "notice": "Function to create the metadata json string for the nft edition"
      },
      "encodeMetadataJSON(bytes)": {
        "notice": "Encodes the argument json bytes into base64-data uri format"
      },
      "numberToString(uint256)": {
        "notice": "Proxy to openzeppelin's toString function"
      },
      "tokenMediaData((string,string,string,uint8[3]),uint256,address)": {
        "notice": "Generates edition metadata from storage information as base64-json blob Combines the media data and metadata"
      },
      "tokenMediaData((string,string,string,uint8[3]),uint256,address,uint256)": {
        "notice": "Generates edition metadata from storage information as base64-json blob Combines the media data and metadata"
      }
    },
    "notice": "Shared NFT logic for rendering metadata associated with editions",
    "version": 1
  },
  "storageLayout": {
    "storage": [],
    "types": null
  }
}